{
  "version": 1,
  "data_source": {
    "driver": "sqlite",
    "dsn": "data.db",
    "pool_size": 1,
    "read_only": true
  },
  "entities": [
    {
      "name": "group",
      "table": "groups",
      "id_column": "id",
      "fields": [
        {
          "name": "id",
          "column": "id",
          "type": "string",
          "nullable": false,
          "primary_key": true
        },
        {
          "name": "name",
          "column": "name",
          "type": "string",
          "nullable": false
        },
        {
          "name": "speciality",
          "column": "speciality",
          "type": "string",
          "nullable": false
        }
      ]
    },
    {
      "name": "student",
      "table": "students",
      "id_column": "id",
      "fields": [
        {
          "name": "id",
          "column": "id",
          "type": "string",
          "nullable": false,
          "primary_key": true
        },
        {
          "name": "full_name",
          "column": "name",
          "type": "string",
          "nullable": false
        },
        {
          "name": "course",
          "column": "course",
          "type": "int",
          "nullable": true
        },
        {
          "name": "group_id",
          "column": "group_id",
          "type": "string",
          "nullable": true
        }
      ]
    },
    {
      "name": "teacher",
      "table": "teachers",
      "id_column": "id",
      "fields": [
        {
          "name": "id",
          "column": "id",
          "type": "string",
          "nullable": false,
          "primary_key": true
        },
        {
          "name": "full_name",
          "column": "name",
          "type": "string",
          "nullable": false
        },
        {
          "name": "disciplines_json",
          "column": "disciplines_json",
          "type": "string",
          "nullable": true
        }
      ]
    },
    {
      "name": "discipline",
      "table": "disciplines",
      "id_column": "id",
      "fields": [
        {
          "name": "id",
          "column": "id",
          "type": "string",
          "nullable": false,
          "primary_key": true
        },
        {
          "name": "name",
          "column": "name",
          "type": "string",
          "nullable": false
        },
        {
          "name": "description",
          "column": "description",
          "type": "string",
          "nullable": false
        }
      ]
    },
    {
      "name": "grade",
      "table": "grades",
      "id_column": "id",
      "fields": [
        {
          "name": "id",
          "column": "id",
          "type": "string",
          "nullable": false,
          "primary_key": true
        },
        {
          "name": "student_id",
          "column": "student_id",
          "type": "string",
          "nullable": false
        },
        {
          "name": "discipline_id",
          "column": "discipline_id",
          "type": "string",
          "nullable": false
        },
        {
          "name": "grade",
          "column": "grade",
          "type": "string",
          "nullable": false
        },
        {
          "name": "date",
          "column": "date",
          "type": "date",
          "nullable": false
        }
      ]
    },
    {
      "name": "schedule",
      "table": "schedule",
      "id_column": "id",
      "fields": [
        {
          "name": "id",
          "column": "id",
          "type": "string",
          "nullable": false,
          "primary_key": true
        },
        {
          "name": "day",
          "column": "day",
          "type": "string",
          "nullable": false
        },
        {
          "name": "group_id",
          "column": "group_id",
          "type": "string",
          "nullable": false
        },
        {
          "name": "lessons_json",
          "column": "lessons_json",
          "type": "string",
          "nullable": true
        }
      ]
    }
  ],
  "endpoints": [
    {
      "method": "GET",
      "path": "/health",
      "op": "builtin_health"
    },
    {
      "method": "GET",
      "path": "/stats",
      "op": "builtin_stats"
    },
    {
      "method": "GET",
      "path": "/students/{id}",
      "op": "get_by_id",
      "entity": "student"
    },
    {
      "method": "GET",
      "path": "/students",
      "op": "find",
      "entity": "student",
      "search_field": "full_name",
      "query_param": "name"
    },
    {
      "method": "GET",
      "path": "/students/{id}/grades",
      "op": "custom_query",
      "query_id": "student_grades",
      "params": [
        {
          "name": "id",
          "in": "path",
          "required": true
        }
      ]
    },
    {
      "method": "GET",
      "path": "/groups/{id}/schedule",
      "op": "custom_query",
      "query_id": "group_schedule",
      "params": [
        {
          "name": "id",
          "in": "path",
          "required": true
        }
      ]
    },
    {
      "method": "GET",
      "path": "/grades",
      "op": "custom_query",
      "query_id": "all_grades"
    },
    {
      "method": "GET",
      "path": "/schedule",
      "op": "custom_query",
      "query_id": "all_schedule"
    },
    {
      "method": "GET",
      "path": "/disciplines",
      "op": "list",
      "entity": "discipline"
    },
    {
      "method": "GET",
      "path": "/teachers",
      "op": "find",
      "entity": "teacher",
      "search_field": "full_name",
      "query_param": "name"
    },
    {
      "method": "GET",
      "path": "/students/{id}/disciplines",
      "op": "custom_query",
      "query_id": "student_disciplines",
      "params": [
        {
          "name": "id",
          "in": "path",
          "required": true
        }
      ]
    }
  ],
  "custom_queries": {
    "all_grades": {
      "sql": "SELECT g.id, g.student_id, COALESCE(s.name, 'Unknown') AS student_name, g.discipline_id, COALESCE(d.name, 'Unknown') AS discipline_name, g.grade, g.date FROM grades g LEFT JOIN students s ON s.id = g.student_id LEFT JOIN disciplines d ON d.id = g.discipline_id ORDER BY g.date DESC LIMIT 80",
      "result_mapping": {
        "date": {
          "type": "date"
        },
        "discipline_id": {
          "type": "string"
        },
        "discipline_name": {
          "type": "string",
          "nullable": true
        },
        "grade": {
          "type": "string"
        },
        "id": {
          "type": "string"
        },
        "student_id": {
          "type": "string"
        },
        "student_name": {
          "type": "string",
          "nullable": true
        }
      },
      "max_rows": 80
    },
    "all_schedule": {
      "sql": "SELECT s.id, s.day, s.group_id, g.name AS group_name, g.speciality, s.lessons_json FROM schedule s LEFT JOIN groups g ON g.id = s.group_id ORDER BY g.name, s.day",
      "result_mapping": {
        "day": {
          "type": "string"
        },
        "group_id": {
          "type": "string",
          "nullable": true
        },
        "group_name": {
          "type": "string",
          "nullable": true
        },
        "id": {
          "type": "string"
        },
        "lessons_json": {
          "type": "string"
        },
        "speciality": {
          "type": "string",
          "nullable": true
        }
      },
      "max_rows": 5000
    },
    "group_schedule": {
      "sql": "SELECT s.id, s.day, s.group_id, g.name AS group_name, g.speciality, s.lessons_json FROM schedule s LEFT JOIN groups g ON g.id = s.group_id WHERE s.group_id = ?",
      "params": [
        "id"
      ],
      "result_mapping": {
        "day": {
          "type": "string"
        },
        "group_id": {
          "type": "string"
        },
        "group_name": {
          "type": "string",
          "nullable": true
        },
        "id": {
          "type": "string"
        },
        "lessons_json": {
          "type": "string"
        },
        "speciality": {
          "type": "string",
          "nullable": true
        }
      },
      "max_rows": 1000
    },
    "student_disciplines": {
      "sql": "SELECT d.id, d.name, d.description FROM disciplines d WHERE d.id IN (SELECT DISTINCT json_extract(value, '$.discipline_id') FROM schedule s, json_each(s.lessons_json) WHERE s.group_id = (SELECT group_id FROM students WHERE id = ?) AND json_extract(value, '$.discipline_id') IS NOT NULL)",
      "params": [
        "id"
      ],
      "result_mapping": {
        "description": {
          "type": "string"
        },
        "id": {
          "type": "string"
        },
        "name": {
          "type": "string"
        }
      },
      "max_rows": 100
    },
    "student_grades": {
      "sql": "SELECT g.id, g.student_id, g.discipline_id, COALESCE(d.name, 'Unknown') AS discipline_name, g.grade, g.date FROM grades g LEFT JOIN disciplines d ON d.id = g.discipline_id WHERE g.student_id = ? ORDER BY g.date DESC",
      "params": [
        "id"
      ],
      "result_mapping": {
        "date": {
          "type": "date"
        },
        "discipline_id": {
          "type": "string"
        },
        "discipline_name": {
          "type": "string",
          "nullable": true
        },
        "grade": {
          "type": "string"
        },
        "id": {
          "type": "string"
        },
        "student_id": {
          "type": "string"
        }
      },
      "max_rows": 500
    }
  },
  "stats": {
    "counters": [
      {
        "name": "students",
        "entity": "student"
      },
      {
        "name": "teachers",
        "entity": "teacher"
      },
      {
        "name": "disciplines",
        "entity": "discipline"
      },
      {
        "name": "grades",
        "entity": "grade"
      },
      {
        "name": "schedule",
        "entity": "schedule"
      }
    ]
  }
}